{
    "applicationHasGuidance": false,
    "applicationHasRestrictions": false,
    "applicationType": "Classic",
    "attorneyActDecisions": null,
    "attorneys": [
        {
            "addresses": [
                {
                    "addressLine1": "25 Cambridge Road",
                    "addressLine2": "CHATTERIS",
                    "addressLine3": "",
                    "country": "",
                    "county": "",
                    "id": 7,
                    "postcode": "PE4 7DH",
                    "town": "",
                    "type": "Primary"
                }
            ],
            "companyName": null,
            "dob": "1972-05-10",
            "email": "bodge@example.com",
            "firstname": "Trevor",
            "otherNames": null,
            "id": 7,
            "middlenames": null,
            "salutation": "Mr",
            "surname": "Bodger",
            "systemStatus": true,
            "uId": "7000-0000-0104"
        }
    ],
    "cancellationDate": null,
    "caseAttorneyJointly": false,
    "caseAttorneyJointlyAndJointlyAndSeverally": false,
    "caseAttorneyJointlyAndSeverally": true,
    "caseAttorneySingular": false,
    "caseSubtype": "pfa",
    "certificateProviders": [
        {
            "addresses": [
                {
                    "addressLine1": "32 Jamestown Street",
                    "addressLine2": "ABLEFIELD",
                    "addressLine3": "",
                    "country": "",
                    "county": "",
                    "id": 5,
                    "postcode": "AB2 8KJ",
                    "town": "",
                    "type": "Primary"
                }
            ],
            "dob": null,
            "email": null,
            "firstname": "Julian",
            "otherNames": null,
            "id": 5,
            "middlenames": null,
            "salutation": "Mr",
            "surname": "Salford",
            "uId": "7000-0000-0088"
        }
    ],
    "donor": {
        "addresses": [
            {
                "addressLine1": "lxzraboqaxnygvbfnbcrdozklqfzpsycwegllkkuubywvvyvjj",
                "addressLine2": "SOLLINGSBURY",
                "addressLine3": "",
                "country": "",
                "county": "",
                "id": 1,
                "postcode": "cytxlxdequ",
                "town": "",
                "type": "Primary"
            }
        ],
        "companyName": null,
        "dob": "1952-07-17",
        "email": "sally.fathing@opgtest.com",
        "firstname": "changeme",
        "otherNames": "Lucy",
        "id": 1,
        "middlenames": "Lucille",
        "salutation": "Mrs",
        "surname": "changeme",
        "uId": "7000-0000-0047"
    },
    "id": 1,
    "lifeSustainingTreatment": null,
    "lpaIsCleansed": true,
    "lpaDonorSignatureDate": "2020-07-15",
    "onlineLpaId": null,
    "receiptDate": "2014-09-26",
    "registrationDate": null,
    "rejectedDate": null,
    "replacementAttorneys": [],
    "status": "Pending",
    "trustCorporations": [
        {
            "addresses": [
                {
                    "addressLine1": "170 High Street",
                    "addressLine2": "Oxford",
                    "addressLine3": "Oxfordshire",
                    "country": "",
                    "county": "",
                    "id": 6,
                    "postcode": "OX1 1XO",
                    "town": "",
                    "type": "Primary"
                }
            ],
            "companyName": "TrustyLaw.com",
            "dob": null,
            "email": "",
            "firstname": null,
            "otherNames": null,
            "id": 6,
            "middlenames": null,
            "salutation": null,
            "surname": null,
            "systemStatus": false,
            "uId": "7000-0000-0096"
        }
    ],
    "uId": "7000-0000-0013"
}
